clickability_test_id,eyecatcher_id,headline_1,headline_2,higher_CTR
52815af1773c13f2b70013fc,5332b51e1fae79f09f0002b2,A Reporter Has An On-Air Mammogram And It Reveals She Has Cancer,She Woke Up One Day For A Cancer Test On National TV. Turns Out It Was A Good Morning To Take It.,1.0
52815af1773c13f2b70013fc,5332b51e1fae79f09f0002b2,She Woke Up One Day For A Cancer Test On National TV. Turns Out It Was A Good Morning To Take It.,She Took A Test On Live TV Hoping That It Would Save A Life. She Never Thought It Would Be Her Own.,2.0
52815af1773c13f2b70013fc,5332b51e1fae79f09f0002b2,A Reporter Has An On-Air Mammogram And It Reveals She Has Cancer,A Reporter's Life Is Saved Thanks To The Assignment She Got One Morning,1.0
52815af1773c13f2b70013fc,5332b51e1fae79f09f0002b2,A Reporter's Life Is Saved Thanks To The Assignment She Got One Morning,She Took A Test On Live TV Hoping That It Would Save A Life. She Never Thought It Would Be Her Own.,2.0
52816f1fbbae1107a00007a1,5332c1e01fae79f09f00f389,Who Has More Rights In America? A Terrorist Or A Marine Who Was Sexually Assaulted?,A Marine Was Assaulted. Her Commander Said She Deserved It For Wearing Running Shorts. Really.,2.0
52816f1fbbae1107a00007a1,5332c1e01fae79f09f00f389,"A Marine Breaks Down Crying Explaining What Happened To His Wife, A Marine",Who Has More Rights In America? A Terrorist Or A Marine Who Was Sexually Assaulted?,1.0
528187a845ccfa1b10000d68,5332c1de1fae79f09f00f344,Can Fast Food Really Be Good For The Soul? These Guys Think So. ,Fast Food Usually Grosses Me Out. But This Video Changed That For 2 Minutes And 10 Seconds. ,2.0
528238e53cf961bfd6006dc4,5332c1b21fae79f09f00ee9d,How One Airport Is About To Start Treating People With Dignity,A Minimum Wage Increase AND Paid Sick Leave? Wow...,1.0
52836efab059b679e1006e09,5332c1e71fae79f09f00f465,This Is Reality For Many Americans When It Comes to Anwering One Question,Food Stamps Have Been Cut By 5 Million. Think That Will Affect The Next Election?,1.0
52852148972cdf420e00a354,5332c1e51fae79f09f00f40e,Carl Sagan Tries To Explain Evolution To An Argumentative Guy,Please Don't Call Carl Sagan If You're Just Going To Yell Nonsense Instead Of Listening To Him,1.0
52852148972cdf420e00a354,5332c1e51fae79f09f00f40e,Please Don't Call Carl Sagan If You're Just Going To Yell Nonsense Instead Of Listening To Him,Carl Sagan Gets A Phone Call From A Guy Who Won't Stop Talking Nonsense. Sagan Handles It Well.,2.0
528696176939c1ccaf0021e4,5332c21d1fae79f09f00f9a5,Most Americans Are 5 Generations Removed From Something That Used To Be All Around Us,"Mother Nature Doesn't Take A Day Off. They Can't, Either.",1.0
528696176939c1ccaf0021e4,5332c21d1fae79f09f00f9a5,"They Make Stuff, Too; It's Just That You Hardly Ever See It Until You Sit Down For Dinner.","If We Didn't Have What They Make, We Would Die. True Story.",2.0
528696176939c1ccaf0021e4,5332c21d1fae79f09f00f9a5,Most Americans Are 5 Generations Removed From Something That Used To Be All Around Us,"They Make Stuff, Too; It's Just That You Hardly Ever See It Until You Sit Down For Dinner.",1.0
528a40c2306c34a2c50012dc,5332c21b1fae79f09f00f97c,"Being A Pink Princess Is Cute And All, But I Hope My Daughter Turns Out Like This Instead","3 Little Geniuses Are Left Alone In A House. The Results? Epic, Awesome And Every Other Adjective.",2.0
528a40c2306c34a2c50012dc,5332c21b1fae79f09f00f97c,"3 Little Geniuses Are Left Alone In A House. The Results? Epic, Awesome And Every Other Adjective.",Tired Of Ads Playing To The Worst Stereotypes Of Girls? Have I Got The 3 Little Geniuses For You.,1.0
528a40c2306c34a2c50012dc,5332c21b1fae79f09f00f97c,3 Little Girls Got Tired Of Being Sleeping Beauties. So They Woke Up And Made Some New Epic Rules.,"3 Little Geniuses Are Left Alone In A House. The Results? Epic, Awesome And Every Other Adjective.",2.0
528a40c2306c34a2c50012dc,5332c21b1fae79f09f00f97c,Girls Can Be Princesses If They Want. But They Can Be So Much More. Hilariously More.,"3 Little Geniuses Are Left Alone In A House. The Results? Epic, Awesome And Every Other Adjective.",2.0
528ba310e10b5a2dc5001f4f,5332c2221fae79f09f00fa47,"If You're Wondering What Life Is Like For Transgender Women, You're In The Right Place",A Few Things You Want To Know About Being Transgender But Were Afraid To Ask,2.0
528bb25f72a5a73e08003cda,5332c2221fae79f09f00fa47,"Hear A Little More About The ""T"" In GLBT",Things You Want To Know About Being Transgender But Were Afraid To Ask,2.0
528bb25f72a5a73e08003cda,5332c2221fae79f09f00fa47,A Few Things You Want To Know About Being Transgender But Were Afraid To Ask,"The ""T"" Might Be At The End Of GLBT, But For Them, It's The Beginning",1.0
528bb25f72a5a73e08003cda,5332c2221fae79f09f00fa47,"The ""T"" Might Be At The End Of GLBT, But For Them, It's The Beginning",Things You Want To Know About Being Transgender But Were Afraid To Ask,2.0
528cda3070125fdeb9003706,5332c22a1fae79f09f00fb1d,"The Day After His Dad Dies, He Waits Until The End Of His Show To Tell Us About It. Just Beautiful.","The Day After His Dad Dies, He Closes The Show By Telling Us About It. It's Pretty Great.",1.0
528e6bc8f7ead40afd003394,5332c24c1fae79f09f00feaf,A Neo-Nazi Walked Into A Jewish Man's Antique Store. Can You Guess What Happened Next?,"He Was Filled With Racism, Hate, And Swastika Tattoos. Then Someone Changed His Mind.",1.0
528e6bc8f7ead40afd003394,5332c24c1fae79f09f00feaf,Why Was A Guy With A Swastika Tattooed On His Neck Hired By A Jewish Shop Owner?,A Neo-Nazi Walked Into A Jewish Man's Antique Store. Can You Guess What Happened Next?,2.0
5296771ec5fae45c550013ee,5332c2741fae79f09f0102e3,And Then She Said That Part About What She Truly Wants For Her Grandson,"She Got Asked If She Could Say Anything To The Huge Audience, What Would It Be? She Immediately Knew",2.0
5296771ec5fae45c550013ee,5332c2741fae79f09f0102e3,"She Got Asked If She Could Say Anything To The Huge Audience, What Would It Be? She Immediately Knew",Looks like Jane Fonda And I Completely Agree On One Thing We Both Want For The Future Of Young Men,1.0
5296771ec5fae45c550013ee,5332c2741fae79f09f0102e3,They Asked If She Had Anything Else She Wanted To Say To The Audience. That's When She Took It Home,Looks like Jane Fonda And I Completely Agree On One Thing We Both Want For The Future Of Young Men,1.0
5296771ec5fae45c550013ee,5332c2741fae79f09f0102e3,And Then She Said That Part About What She Truly Wants For Her Grandson,They Asked If She Had Anything Else She Wanted To Say To The Audience. That's When She Took It Home,2.0
529a4c1eacf05b263b000b50,5332c2771fae79f09f01034c,"Mallika Sherawat Stands up For Women's Rights In Her Country, And Publicly Fights For Them",Female Journalist Can't Believe Actress Could Criticize India That Way. She Gets A Lesson.,2.0
529a4c1eacf05b263b000b50,5332c2771fae79f09f01034c,Bollywood Actress Given Chance To Apologize For Criticizing India. She Fights Back Instead.,"Mallika Sherawat Stands up For Women's Rights In Her Country, And Publicly Fights For Them",1.0
529a4c1eacf05b263b000b50,5332c2771fae79f09f01034c,"Mallika Sherawat Stands up For Women's Rights In Her Country, And Publicly Fights For Them","She's Not Sorry For What She Said. In Fact, She's Just Getting Angrier.",2.0
529d2985c8322709000001b0,5332c27c1fae79f09f0103d2,"According To This Animation, 'Finding Nemo' Isn't A Children's Movie. It's A Warning.",Pretty Soon We'll Start Seeing 'Finding Nemo' As A Warning. This Animation Will Show You How.,1.0
529d2985c8322709000001b0,5332c27c1fae79f09f0103d2,"'Finding Nemo' Isn't A Children's Movie, It's A Warning. This Animation Will Show You How.",Pretty Soon We'll Start Seeing 'Finding Nemo' As A Warning. This Animation Will Show You How.,1.0
529d2985c8322709000001b0,5332c27c1fae79f09f0103d2,Pretty Soon We'll Start Seeing 'Finding Nemo' As A Warning. This Animation Will Show You How.,"'Finding Nemo' Is A Warning, Not A Children's Movie. This Animation Will Show You How.",2.0
52a0f4866a71e05cf10006b3,5332c2a81fae79f09f010914,"The Children Are Singing In The Halls Of Power, And They Won't Take No For An Answer","Watch Two Policeofficers React To Civil Disobedience, And What Happens After",2.0
52a0f4866a71e05cf10006b3,5332c2a81fae79f09f010914,"Watch Two Policeofficers Handle A Bunch Of Children Protesting The Law, And How They Handle It","The Children Are Singing In The Halls Of Power, And They Won't Take No For An Answer",1.0
52a16b68f478ef23fd00006b,5332c2b01fae79f09f0109e4,I Was As Shocked As That Cute Little Boy At The Crazy Direction This Ad Took At The End,Seems Like An Odd Message For A Company That Makes Things That Beat People Up,1.0
52a16b68f478ef23fd00006b,5332c2b01fae79f09f0109e4,Young Teen Trains Hard. Little Brother In Danger. Where's The Right Hook?,I Was As Shocked As That Cute Little Boy At The Crazy Direction This Ad Took At The End,2.0
52a51738ea590df7260060b6,5332c2cd1fae79f09f010d8a,Is A Moment Of Silence Going To Solve Gun Violence?,"Sometimes, Silence Is A Good Thing. Here, It's Most Definitely Not.",2.0
52a51738ea590df7260060b6,5332c2cd1fae79f09f010d8a,Tired of People Senselessly Dying? Me Too.,"Sometimes, Silence Is A Good Thing. Here, It's Most Definitely Not.",2.0
52a51738ea590df7260060b6,5332c2cd1fae79f09f010d8a,It's Been One Year Since A Really Terrible Event Took Place. What's Changed Since Then?,Is A Moment Of Silence Going To Solve Gun Violence?,1.0
52a56dfeea590d2e230084e5,5332c2c21fae79f09f010c13,I Know Far Too Many People Who Were Almost A Statistic On This Map. And Some Who Are.,This Map Looks Really Pretty ... Until You Realize What It Means,2.0
52a56dfeea590d2e230084e5,5332c2c21fae79f09f010c13,This Map Looks Really Pretty ... Until You Realize What It Means,"Why There Are So Many Blue Dots On This Map, And Why We Should All Care",1.0
52a56dfeea590d2e230084e5,5332c2c21fae79f09f010c13,"I Loved The Pretty Dots On This Map ... But Upon Further Inspection, I Felt Sick To My Stomach","Why There Are So Many Blue Dots On This Map, And Why We Should All Care",1.0
52a56dfeea590d2e230084e5,5332c2c21fae79f09f010c13,I Know Far Too Many People Who Were Almost A Statistic On This Map. And Some Who Are.,"I Loved The Pretty Dots On This Map ... But Upon Further Inspection, I Felt Sick To My Stomach",2.0
52a6a90cd5395fede900034e,5332c2cb1fae79f09f010d1f,"A Gigantic Bully Tried To Mess With One Young Farmer, But She's Not Havin' It","Those Business-y Folk May Have Boatloads Of Cash, But These Farmers Have Tenacity. And Cute Animals.",1.0
52a6a90cd5395fede900034e,5332c2cb1fae79f09f010d1f,"A Gigantic Bully Tried To Mess With One Young Farmer, But She's Not Havin' It",Meet The Town Of Tenacious Farmers That Refuses To Be Bullied,1.0
52a6a90cd5395fede900034e,5332c2cb1fae79f09f010d1f,"A Gigantic Bully Tried To Mess With One Young Farmer, But She's Not Havin' It",In Which A Tenacious Podunk Town Takes On A Big Business Bully,1.0
52a765bbb7477d022f00314c,5332c2d01fae79f09f010dd2,Why Cindy Crawford Set Out To Be Financially Independent,"For Many Divorced Women, Having To Deal With This Every Week Is Simply What Life Is",2.0
52a765bbb7477d022f00314c,5332c2d01fae79f09f010dd2,How Men Sometimes Control The Power In A Relationship Even When It's Over,Why Cindy Crawford Set Out To Be Financially Independent,1.0
52a765bbb7477d022f00314c,5332c2d01fae79f09f010dd2,How Men Sometimes Control The Power In A Relationship Even When It's Over,How The Power Struggle That Cindy Crawford Watched Between Her Mother And Father Shaped Who She Is,1.0
52a765bbb7477d022f00314c,5332c2d01fae79f09f010dd2,How The Power Struggle That Cindy Crawford Watched Between Her Mother And Father Shaped Who She Is,"For Many Divorced Women, Having To Deal With This Every Week Is Simply What Life Is",2.0
52a8d50c5d65a802ff00019f,5332c2e21fae79f09f010fed,"Turns Out, Happiness Is Sorta Like A Muscle. And Here's How You Can Exercise It.","Finally, Scientific Proof As To Why You Love Upworthy So Much ;)",1.0
52a8d50c5d65a802ff00019f,5332c2e21fae79f09f010fed,"How To Make The Happiness Chemicals In Your Blood Better, Faster, Stronger!",Ever Wonder Why Watching Meaningful Videos On The Internet Gives Us That Little Boost Of Happiness?,1.0
52a8d50c5d65a802ff00019f,5332c2e21fae79f09f010fed,"How To Make The Happiness Chemicals In Your Blood Better, Faster, Stronger!","Finally, Scientific Proof As To Why You Love Upworthy So Much ;)",1.0
52a8d50c5d65a802ff00019f,5332c2e21fae79f09f010fed,"Turns Out, Happiness Is Sorta Like A Muscle. And Here's How You Can Exercise It.",Ever Wonder Why Watching Meaningful Videos On The Internet Gives Us That Little Boost Of Happiness?,1.0
52a8e637c5a9cc68150005b8,5332c2e31fae79f09f01101a,You Never Know What Acts Of Generosity And Courage Will End Up Being The Most Remembered,"A Firefighter Went To Put Out A Fire, But He Had No Idea He Would Be A Hero Of A Different Kind",2.0
52aa42e850707cdfbb00228d,5332c31a1fae79f09f011670,"Women? Choice? Ha Ha Ha, Not In this Hospital.",Women Not Getting The Reproductive Healthcare They Need? How About No.,1.0
52aac89bddc22f097800532f,5332c2f81fae79f09f011268,"One Photo A Day Can Keep The Doctor Away? Maybe, Just Maybe.",You Know You Take Zillions Of Photos With Your Cellphone Anyway; Why Not Do This With Them?,2.0
52ab4c1d5ff9c8ec92000283,5332c2fe1fae79f09f01132b,A Total Genius Explains How The Future Might Look If We Are All A Little More... Empathetic?,"Is That Your Globally-Extended Identity, Or Are You Just Happy To See Me?",1.0
52b0ce214a5556af31001265,5332c3241fae79f09f0117b1,Have You Asked Yourself How Many Of Your Holiday Emails And Trips To The Mall The NSA Has Tracked?,We Would Punch These Santa Spies In The Face In Real Life. Why Are We Accepting Them Online?,2.0
52b33002398b1b1d86004265,5332c3371fae79f09f0119a5,What They're Doing To Kids In Pennsylvania Is Dooming Them To Fail,Is This The Future Of Education For All Of Our Kids?,1.0
52b6312146d402ffbb001d4c,5332c34b1fae79f09f011bd5,There's Something Seriously Wrong With What Were Doing To Boys Before They Become Men,Why Are Girls Are Made Of Sugar And Spice And Everything Nice But Boys Are Made To Be Terrible?,1.0
52b789601ae59d5c8f0009cc,5332c34b1fae79f09f011bde,A Politician (Male) Trying To Ban Abortions Literally Cannot Fathom Why Women Have Abortions,A Dude Trying To Ban Abortions Is Asked A Question He Never Considered. It's So Obvious It Hurts.,2.0
52b789601ae59d5c8f0009cc,5332c34b1fae79f09f011bde,A Dude Trying To Ban Abortions Is Asked A Question He Never Considered. It's So Obvious It Hurts.,Dude Trying To Ban Abortions Is Asked Why Women Have Abortions. He Answers 'Because Economics.',1.0
52b789601ae59d5c8f0009cc,5332c34b1fae79f09f011bde,You Will Not Believe How Appallingly A Politician Trying To Ban Abortions Fails An Obvious Question,A Dude Trying To Ban Abortions Is Asked A Question He Never Considered. It's So Obvious It Hurts.,2.0
52cb0b591051778546000861,5332c3721fae79f09f011ff6,"I’m Starting To Think About My Tax Return, And This Guy Makes A Ton Of Sense",The Number One Reason To Get A Tax Deduction Of Some Sort Is…,1.0
52cb0b591051778546000861,5332c3721fae79f09f011ff6,"I’m Starting To Think About My Tax Return, And This Guy Makes A Ton Of Sense",Why Using Money For War That Should Be Going To The Poor Is Thievery,1.0
52cb0b591051778546000861,5332c3721fae79f09f011ff6,Is This The New Face Of The Catholic Church? Because I’m Loving It.,Why Using Money For War That Should Be Going To The Poor Is Thievery,1.0
52cc4e99150a38d2100006ca,5332b6391fae79f09f000c80,Bill Nye On Why Your Horoscope Actually Belongs To Someone Else,"Is Bill Nye A Fun-Loving Sagittarius, Or A Sexy Scorpio?",1.0
52cc4e99150a38d2100006ca,5332b6391fae79f09f000c80,Nothing Could Have Prepared Bill Nye For This Harrowing Astrological Question,"Is Bill Nye A Fun-Loving Sagittarius, Or A Sexy Scorpio?",1.0
52cc4e99150a38d2100006ca,5332b6391fae79f09f000c80,"Is Bill Nye A Fun-Loving Sagittarius, Or A Sexy Scorpio?",Bill Nye Points Out The Biggest Problem With Modern Astrology,2.0
52cddb505661f78807000ec7,5332c3321fae79f09f011917,This Beautiful Gay Military Wedding And That Amazing Military Dad Caused Me To Feel Emotions. Rude.,"The Wedding Is Beautiful And All, But His Dad's Response To Him Coming Out? It's Just... Wow.",2.0
52cddb505661f78807000ec7,5332c3321fae79f09f011917,Amazing Military Dad + Wonderful Gay Military Wedding = Chopped Onions In My Eye,A Military Dad Finds Out His Son Is Gay And Responds In The Most Honorable Way Possible. Like A Dad.,2.0
52cddb505661f78807000ec7,5332c3321fae79f09f011917,Amazing Military Dad + Wonderful Gay Military Wedding = Chopped Onions In My Eye,A Son Comes Out To His Military Dad Before His Wedding To A Military Man And Now I'm Chopping Onions,2.0
52cddb505661f78807000ec7,5332c3321fae79f09f011917,This Beautiful Gay Military Wedding And That Amazing Military Dad Caused Me To Feel Emotions. Rude.,His Dad Was Disappointed In Him When He Came Out... For Not Telling Him Sooner.,2.0
52cddb505661f78807000ec7,5332c3321fae79f09f011917,A Military Dad Finds Out His Son Is Gay And Responds In The Most Honorable Way Possible. Like A Dad.,This Beautiful Gay Military Wedding And That Amazing Military Dad Caused Me To Feel Emotions. Rude.,1.0
52cddb505661f78807000ec7,5332c3321fae79f09f011917,Amazing Military Dad + Wonderful Gay Military Wedding = Chopped Onions In My Eye,"The Wedding Is Beautiful And All, But His Dad's Response To Him Coming Out? It's Just... Wow.",2.0
52cddb505661f78807000ec7,5332c3321fae79f09f011917,Amazing Military Dad + Wonderful Gay Military Wedding = Chopped Onions In My Eye,His Dad Was Disappointed In Him When He Came Out... For Not Telling Him Sooner.,2.0
52cde067e00e5b90390009bb,5332b7fc1fae79f09f001a20,A Woman Pointed Out Sexism And The Internet Exploded. But When A Dude Says It...,Annoyed About The Internet Finding Everything Sexist? Peep This Video.,1.0
52cde067e00e5b90390009bb,5332b7fc1fae79f09f001a20,"And Lo, A Snarky YouTube Personality Looked Down On Misogynists And Said, 'Yo, Stop That'",A Woman Pointed Out Sexism And The Internet Exploded. But When A Dude Says It...,2.0
52cde067e00e5b90390009bb,5332b7fc1fae79f09f001a20,A Woman Pointed Out Sexism And The Internet Exploded. But When A Dude Says It...,"""But It's *JUST* A Video Game."" ... Yeah, No. Kisses, Lovable Internet Jerk",1.0
52ceb70737594313bc0014ec,5332b9031fae79f09f0020e8,Are We Really All Created Equal?,Do You Think That These Humans Were Created Equal After Seeing These Photos?,2.0
52ceb70737594313bc0014ec,5332b9031fae79f09f0020e8,All Of Us Are Created Equal — But Are Some Of Us More Equal Than Others?,Do You Think That These Humans Were Created Equal After Seeing These Photos?,2.0
52ceb70737594313bc0014ec,5332b9031fae79f09f0020e8,Are We Really All Created Equal?,We're Told That All Humans Are Created Equal. Do You See That In These Photos?,2.0
52d01b5cc4759bf848003cdc,5332fdf8a2fc90ead0002df1,It's Truly Shocking That These Words Were Coming Out Of Your Television Last Year,Is This The Kind Of Misogynist Mishegas We Can Look Forward To Hearing In 2014?,1.0
52d2dfdae8f8694d1900151f,5332fdd6a2fc90ead0002d61,A Doctor Has Spent Several Decades Dressing Up Like A Homeless Man. The Reason Is Fantastic.,A Man Has Spent Several Decades Dressing Up Like A Homeless Person. The Reason Is Fantastic.,1.0
52d6a1d7519b9329f9002188,5332fd8ea2fc90ead0002c21,Here's A Fact About Sharks And Humans That'll Stay With You Every Hour On The Hour Today,I Simply Cannot Fathom How Killing This Many Living Things Is Even Possible,1.0
52d6b780e0a8cd9e23002556,5332b8ad1fae79f09f001e62,A Short Film That Shows You How Your Brain Breaks When You Do Something You're Not Supposed To Do,An Animated Brain Explains The Way You Can Temporarily Go Blind Without Actually Going Blind,1.0
52d6b780e0a8cd9e23002556,5332b8ad1fae79f09f001e62,"Multitasking Is Considered A Positive Characteristic, But It Can Actually Kill You",A Short Film That Shows You How Your Brain Breaks When You Do Something You're Not Supposed To Do,2.0
52d6b780e0a8cd9e23002556,5332b8ad1fae79f09f001e62,A Short Film That Shows You How Your Brain Breaks When You Do Something You're Not Supposed To Do,You Shouldn't Text And Drive For The Same Reason You Shouldn't Zone Out While A Lion Eats Your Arm,1.0
52df12703f80b34f8200001f,5332fca6a2fc90ead00027de,The Next 6 Minutes Will Probably Piss You Off. Hopefully For The Right Reason.,"They Say 'Sex Sells', But What Exactly Is It Selling?",1.0
52df12703f80b34f8200001f,5332fca6a2fc90ead00027de,What's The Difference Between Being A Sexual Subject And A Sexual Object? A Lot.,"They Say 'Sex Sells', But What Exactly Is It Selling?",1.0
52e0428bc6e09c537a000007,5332fc89a2fc90ead0002764,She Set Out To Prove That Happiness Could Be Inversely Proportional To Her Carbon Footprint,"To Prove Humans Could Be Happier With Simpler Lives, She Came Up With An Elaborate Experiment",2.0
52e2cdde2e96fea86e000034,5332b6411fae79f09f000cbc,Our Dept. of State Asked Maya Angelou To Say Some Things About Him.  What She Said Is Unforgettable.,You Really Need To Watch Maya Angelou Honor Nelson Mandela.  It's Worth Your Time.,1.0
52e2cdde2e96fea86e000034,5332b6411fae79f09f000cbc,You Have To Take Five Minutes To See Maya Angelou Say These Things About Nelson Mandela,Our Dept. of State Asked Maya Angelou To Say Some Things About Him.  What She Said Is Unforgettable.,2.0
52e2cdde2e96fea86e000034,5332b6411fae79f09f000cbc,Our Dept. of State Asked Maya Angelou To Say Some Things About Him.  What She Said Is Unforgettable.,Watch Maya Angelou Immortalize The Great Nelson Mandela In Less Than Five Minutes,1.0
52e5daeca7107adf70000013,5332b8811fae79f09f001d6c,What It's Like To Say Goodbye To Your Kids Every Single Weekend,A Single Dad Gets Creative In The Lonely Moments After His Kids' Visitation Ends,2.0
52e6770068476eb3aa00000e,5332fc03a2fc90ead0002519,Can You See What's Not Quite Right With These H&M Posters?,I Think We'd All Like Having These Stickers On All Photoshopped Posters,1.0
52e6770068476eb3aa00000e,5332fc03a2fc90ead0002519,Something's Not Quite Right With These H&M Posters,I Think We'd All Like Having These Stickers On All Photoshopped Posters,1.0
52e68ce2fb797ad47c00001d,5332fbfba2fc90ead00024f6,Can Someone Remind Me What Breasts Are For Again?,The Amusing Response SNL Give To Victoria's Secret After They Ban A Mom From Breastfeeding In Store,2.0
52ec0988cab44d43cf000001,5332fc2aa2fc90ead00025ba,An Open Letter To Men Who Think They Know More About What's Best For This Woman Than This Woman...,"Dear Senator, Have You Tried NOT Taking Away Women's Rights? That Might Be Healthier.",1.0
52ec0988cab44d43cf000001,5332fc2aa2fc90ead00025ba,It Would Be So Much Nicer If Politicians Stayed Out Of Women's Personal Business And Parts And Stuff,An Open Letter To Men Who Think They Know More About What's Best For This Woman Than This Woman...,2.0
52f2b726c0f551a110000024,5332bb7c1fae79f09f0050f0,A 16-Year-Old Explains Why Everything You Thought You Knew About Beauty May Be Wrong. With Math.,Math Can Be Stunning Sometimes And Full Of Lies Other Times. Especially When Calculating Beauty.,1.0
52f2b726c0f551a110000024,5332bb7c1fae79f09f0050f0,Math Can Be Stunning Sometimes And Full Of Lies Other Times. Especially When Calculating Beauty.,A 16-Year-Old Explains Why Everything You Thought You Knew About Beauty May Be Wrong. With Math.,2.0
52f2b726c0f551a110000024,5332bb7c1fae79f09f0050f0,A 16-Year-Old Explains Why Everything You Thought You Knew About Beauty May Be Wrong. With Math.,Math Can Be Stunning Sometimes And Full Of Lies Other Times. Especially When Calculating Beauty.,1.0
52f5085482cabf5c9f000018,5332fa6da2fc90ead0001e0a,"Preventable Diseases We Should've Slammed The Door On A Long Time Ago, But They're Baaaack",The Debate On Vaccines Looks Completely Nutty When You See What's Happened In The Last 5 Years,2.0
52f5177882cabf6b6400002b,5332b6451fae79f09f000cd4,See How 'Development' Is Messing With Tribal People's Rights,"A, Smart, Satirical Look At what Development *Really* Does In Our World",2.0
52f5177882cabf6b6400002b,5332b6451fae79f09f000cd4,Have A Look At What White People Try To Do With 'Development' — And Fail Miserably At,"How The ""Trust Us, Let Us Help You"" Type Of Development Is Wrong",1.0
52f5177882cabf6b6400002b,5332b6451fae79f09f000cd4,Have A Look At What White People Try To Do With 'Development' — And Fail Miserably At,See How 'Development' Is Messing With Tribal People's Rights,1.0
52f574f448e43cc9a3000008,5332fa51a2fc90ead0001d77,Two Senators Support A Questionable Project. An Expert Goes 'Wha-Bam! Facts!',A Fact Whiz Is Here To Clear Up 3 Myths We've Been Gullible Enough To Believe,2.0
52f9153f1230289238000007,5332b8991fae79f09f001df6,"Normally, Few Women Work Here. If More People Saw Her Story, That Might Change.",Meet A Woman Who Walks On Metal Beams All Day,1.0
52f915b58febdad498000008,5332b5b31fae79f09f000718,A Series Of Portraits And Feet Somehow Capture The Essence Of The Egytpian Revolution,Here Is How One Iranian Woman Captured Humanity In A Series Of Stunning Photographs,2.0
52f915b58febdad498000008,5332b5b31fae79f09f000718,Here Is How One Iranian Woman Captured Humanity In A Series Of Stunning Photographs,How Do You Capture The Essence Of The Egyptian Revolution? One Iranian Woman Had An Idea.,1.0
52fb6fdd0a9b916d7b000018,5332b89a1fae79f09f001dfe,"Guide Dogs Don't Just Help Those Who Can't See, But Also Those Who Have Seen Too Much",Are You A Dog Person? You Will Be After This Ad Goes From Horrible To Heartwarming.,2.0
52fba2c919639b4552000032,5332b89c1fae79f09f001e0a,This Guy Wants Everyone To Pain Their Thumbnails Red So They'll Stop Texting While Driving,Who Knew A Bottle Of Red Nail Polish Might Be Responsible For Saving Lives?,2.0
52fd18ada0678d52db000041,5332b8a71fae79f09f001e3e,What One Bridge Can Teach Other Bridges About Saving Hundreds Of Lives,How A Small Change Dropped A Bridge's Suicide Rate By 77%,2.0
