clickability_test_id,eyecatcher_id,headline_1,headline_2,higher_CTR
5390b09bbe300632ee000010,538d08a513f17fb43e000017,"Creams, Lotions And Potions —Maintaining A Vagina Should NOT Be This Intense","Wow, I Didn’t Realize That My Vagina Had A Shelf Life Until Now ... ?",2.0
53925a00af25ee9d90000008,53924fe0af25ee9d90000001,Want To Know How To Know If She's Asking For It? She'll Ask For It.,"When A Dude Says To Her That Maybe She's Asking For It, She Has A Pretty Perfect Response",2.0
53925a00af25ee9d90000008,53924fe0af25ee9d90000001,Want To Know How To Know If She's Asking For It? She'll Ask For It.,"If You Think She's Asking For It, Then You Need To Start Dressing Differently At Restaurants",2.0
53925a00af25ee9d90000008,53924fe0af25ee9d90000001,He Said She Was Asking For It. She Responded Appropriately.,Want To Know How To Know If She's Asking For It? She'll Ask For It.,1.0
53925a00af25ee9d90000008,53924fe0af25ee9d90000001,Want To Know How To Know If She's Asking For It? She'll Ask For It.,The Secret To Getting Someone To Sleep With You Is Actually Not A Secret At All,2.0
539349097dbf65ee7a00002e,53934c7a7dbf65f5e4000045,There's Something About The Legalization Of Marijuana That Should Make You Uncomfortable,Do The Folks Who Suffered The Criminalization Of Marijuana Get To Profit From Its Legalization?,1.0
539349097dbf65ee7a00002e,53934c7a7dbf65f5e4000045,An Uncomfortable Reality About The Legalization Of Marijuana,We Need To Ask Who Gets To Profit As Marijuana Gets Legalized,1.0
539349097dbf65ee7a00002e,53934c7a7dbf65f5e4000045,We Need To Ask Who Gets To Profit As Marijuana Gets Legalized,There's Something About The Legalization Of Marijuana That Should Make You Uncomfortable,2.0
539349097dbf65ee7a00002e,53934c7a7dbf65f5e4000045,Do The Folks Who Suffered The Criminalization Of Marijuana Get To Profit From Its Legalization?,An Uncomfortable Reality About The Legalization Of Marijuana,2.0
539358057dbf65e76f000046,5393573f7dbf65ee7a000038,A Car Company Just Guilted An Entire Movie Theater Into Watching Its PSA. I'm Slow-Clapping.,A PSA Got An Entire Movie Theater Audience To Use Their Phones So It Could Teach Them A Lesson,2.0
5395cd1685b18f196500001d,5395ccb585b18fe0c2000018,Just Did A Google Search For 'Picking Up Girls.' *Vomit Sounds* So Glad This Video Exists Though.,Hint: Sticks. Dog Poop. Litter. Answer: Things We Should 'Pick Up.' Notice What's NOT On That List?,1.0
5395cd1685b18f196500001d,5395ccb585b18fe0c2000018,Hint: Sticks. Dog Poop. Litter. Answer: Things We Should 'Pick Up.' Notice What's NOT On That List?,"There's Only One Real Way To Pick Up A Girl, And You'd Never Do It To A Stranger",2.0
5395fa8f0e0fa8f43a000001,5390ce2abe30066816000032,Trying The Internet For The First Time Turned These Seniors Into Funny Geeks. Look At Them Go!,These Elderly Folks Were Just Schooled By A Bunch Of Teens And It’s About Time,2.0
5395fa8f0e0fa8f43a000001,5390ce2abe30066816000032,Trying The Internet For The First Time Turned These Seniors Into Funny Geeks. Look At Them Go!,Watching These Elderly Folks React To The Internet For The First Time Warmed Even My Cold Heart,2.0
5398737573acb62fca000031,5396559c16d48c9ce900002b,A Model Who Thinks She’s Not Portrayed In The Media?  I’ve Got To Hear This One.,She Never Saw Models Who Looked Like Her So She Changed It ... By Becoming One Herself.,2.0
53987eab73acb6aa9b00002b,539867c673acb6f3d2000017,What It Looks Like When We Judge People At First Glance,A Tattooed Veteran And Others Help Us Remember Not To Be So Judgmental,1.0
53987eab73acb6aa9b00002b,539867c673acb6f3d2000017,A Touching Reminder To Think Before We Judge Others,A Tattooed Veteran And Others Help Us Remember Not To Be So Judgmental,1.0
53987eab73acb6aa9b00002b,539867c673acb6f3d2000017,A Tattooed Veteran And Others Help Us Remember Not To Be So Judgmental,A Music Video That Reminds Us Not To Judge People At First Glance,2.0
539887f973acb6f3d2000054,5398866473acb668f700003e,A Comedian Saw The Largest Diamond In The World And Got Furious. Historically Furious.,"So We ‘Found’ Diamonds In India, Huh? Sorta Like How Columbus ‘Found’ America?",1.0
539887f973acb6f3d2000054,5398866473acb668f700003e,His Hilarious Rant About Diamonds And Colonialism Is Totally NSFHC (Not Safe For History Class),"In 2 Minutes, This Comedian Will Give You A Better (NSFW) History Lesson Than 2 Hours At A Museum",2.0
539887f973acb6f3d2000054,5398866473acb668f700003e,A Comedian Saw The Largest Diamond In The World And Got Furious. Historically Furious.,His Hilarious Rant About Diamonds And Colonialism Is Totally NSFHC (Not Safe For History Class),1.0
539887f973acb6f3d2000054,5398866473acb668f700003e,"In 2 Minutes, This Comedian Will Give You A Better (NSFW) History Lesson Than 2 Hours At A Museum","So We ‘Found’ Diamonds In India, Huh? Sorta Like How Columbus ‘Found’ America?",1.0
5398c63b73acb668f7000092,5398c432326359acdf00009e,A Group Of Women Head To The Beach And Deliver A Message As Refreshing As Their Tropical Locale,"4 Women Head To The Beach And Drown A Bunch Of Stupid, Wrong, And Outdated Standards Of Beauty",2.0
5398c63b73acb668f7000092,5398c432326359acdf00009e,"4 Women Head To The Beach And Drown A Bunch Of Stupid, Wrong, And Outdated Standards Of Beauty",A Photo Shoot Designed To Make Everyone Feel Good About Their Bodies Is The Best Kind Of Photo Shoot,1.0
5398de12d5d900ef08000013,53a8ba4c7bb5bc43d000003d,Sex On The Internet: Be Prepared For Some Highly Unsexy Statistics,Not All Sex On The Internet Is Consensual Craigslist Hookups,1.0
5398fd9d6a3930c78400002d,5398e5896a3930f06d00001b,Being Poor Has Never Been A Crime In This Country. Until Now.,Why For-Profit Probation Companies Need To Be Sent To Jail,1.0
5398fd9d6a3930c78400002d,5398e5896a3930f06d00001b,These People Making Money Off Of Poor Folks Who Have Almost Nothing Should Be Sent To Jail,Why For-Profit Probation Companies Need To Be Sent To Jail,1.0
53990fb7d5d900b82500002d,53990d77d5d900ef08000028,"When The Worst Stuff Happens, Sometimes It Feels Like It Will Never End","They're Calling This ""Invisible Scars."" Sounds Accurate.",2.0
5399e6b88bc010a36b00003a,539a0ce68a0640a07d000017,"Here's How The Media Should Be Talking About Fat People, But Don't Have The Courage To","We Talk About Their Bodies All The Time, Maybe We Should Hear How They Feel About That?",1.0
539a069a8a06400fe3000016,53993a43c766391797000011,A Lovely Young Lady Sings Her Heart Out About Autism,"This Girl Wrote New Lyrics For 'Let It Go,' And They Are Quite Stunning",2.0
539a41f9e5b96d00db000044,53a1c16f0a0cb8f283000056,The Condom Of The Future Looks A Lot Smarter Than The Ones You've Seen On The Shelves,"Don't Mind Me, Just Geeking Out Over The Condom Of The Future",1.0
539c24359123cd1f5f000008,539c2371ddf1103fb2000006,One Animal Shelter's Dogs Rescue 5000 Office Workers. I'd Wag My Tail If I Had One.,"Sad Pet Adoption Ads Stopped Working, So One Animal Shelter Came Up With A Brilliant New Idea",2.0
539cabacddf110e08f000015,539ca2b2ddf110f84900001c,Got A Minute? This Zany Comedian Would Like To Free You From Your Fears And Fix Your Life.,It Only Takes One Single Minute For This Zany Comedian To Change How You Think About Your Life,2.0
539dda25050be602a8000020,5399c86c8bc0100ddc00000f,The Genius Way To Never Lose An Argument Again,Putting The 'No' Back Into 'Negotiate',1.0
53a1af910a0cb881b500003f,53966ae2dd8b0d83c6000006,A Teacher Read His Class A Suicide Note From Far Away. One Of His Students Heard More Than Others.,A Teacher In Hong Kong Reads His Class A Suicide Note From Holland. It Hit Close To Home For Her.,1.0
53a1cf740a0cb833fa000072,53a1b6bb33623d1bb100004f,Think You Hit Your Prime In Your 20’s? Don't Be So Sure.,You Might Wanna Ask Yourself These 3 Questions Every Year On Your Birthday,2.0
53a26891b5839f7fc5000025,53a268b98a51fe80c2000024,3 Little Words Uttered By This Famous Man Might Urge You To Keep On Trying,Watching Those Eyes Smile In The Face Of All This Adversity Is Truly Awesome,1.0
53a26891b5839f7fc5000025,53a268b98a51fe80c2000024,What's A Man Like This Say In The Face Of All Of The Adversity He's Experienced In His Life?,3 Little Words Uttered By This Famous Man Might Urge You To Keep On Trying,2.0
53a772df4a8b06827e000008,53a771338fb8a08839000007,Joe's Grandfather Continues To Prove What A Badass Supportive Family Member Looks Like,Joe Was Super Nervous Coming Out To His Grandfather. Joe Was Silly. His Grandpa Kicks Ass.,2.0
53a772df4a8b06827e000008,53a771338fb8a08839000007,Joe Was Super Nervous Coming Out To His Grandfather. Joe Was Silly. His Grandpa Kicks Ass.,"5 Years After Coming Out, Joe's Grandfather Continued To Prove What A Badass He Is",1.0
53a85c804a8b06d84b000026,53a1f6fe33623d34770000a2,"Unlike Microwaves, Babies Don't Come With User Manuals","Moms Get Their Own Classes And Lots Of Ways To Connect. Dads Need Networking, Too.",1.0
53a85c804a8b06d84b000026,53a1f6fe33623d34770000a2,"Moms Get Their Own Classes And Lots Of Ways To Connect. Dads Need Networking, Too.",This Man Clearly Loves His Daughter. So Why Does He Have To Go To 'Dad School'?,2.0
53a85c804a8b06d84b000026,53a1f6fe33623d34770000a2,"Moms Get Their Own Classes And Lots Of Ways To Connect. Dads Need Networking, Too.",Sometimes Being A Dad Is Just Super Hard,2.0
53a8f12d7bb5bcf6eb000076,53a71b4657b860d9a800000c,A Mesmerizing Video Puts A Face Behind The Dropout Statistics We Hear So Often,"A Group In Cali Is Taking On The High School Drop Out Issue, One Stirring Story At A Time",1.0
53a8f12d7bb5bcf6eb000076,53a71b4657b860d9a800000c,A High School Teen With Some Serious Resolve Is Refusing To Follow In His Family's Footsteps,"A Group In Cali Is Taking On The High School Drop Out Issue, One Stirring Story At A Time",1.0
53a8f12d7bb5bcf6eb000076,53a71b4657b860d9a800000c,"A Group In Cali Is Taking On The High School Drop Out Issue, One Stirring Story At A Time","He Didn't Want To Be What Everyone Expected Of Him, So He Became Something Else Instead",2.0
53a9bd237bb5bcb2470000c2,53a9d70c7fb9d6bd7d00001a,Rarely Does An Infographic Make Me Feel Like I Can Make A Difference In The World. This One Did.,The Average Amount Of Energy You Waste In 1 Week Could Power A TV For How Many Years???,1.0
53a9bd237bb5bcb2470000c2,53a9d70c7fb9d6bd7d00001a,How Many Pounds Of Trash Do You Create Each Year? Hint: It's A Lot More Than You Weigh.,Rarely Does An Infographic Make Me Feel Like I Can Make A Difference In The World. This One Did.,2.0
53a9bd237bb5bcb2470000c2,53a9d70c7fb9d6bd7d00001a,Rarely Does An Infographic Make Me Feel Like I Can Make A Difference In The World. This One Did.,How Many Trees Could You Save With All That Newspaper And Junk Mail?,1.0
53a9cc7e7fb9d68e9600000a,53a903da7bb5bc1273000082,The Actor From ‘Harry Potter’ Is Asked About ‘The Friend Zone’ And Says The Absolute Right Thing,Watch A Disgusting Concept Get Drop-Kicked For The Good Of All Genders By A Really Swell Dude,1.0
53a9cc7e7fb9d68e9600000a,53a903da7bb5bc1273000082,The Actor From ‘Harry Potter’ Is Asked About ‘The Friend Zone’ And Says The Absolute Right Thing,A British Actor Rebukes A Stupid Notion About Relationships And Manages To Stay Classy,1.0
53ac4bc867e86e4aae0000a0,53ac4e10f33bfc441a000001,"A Brainy, Psychology Dude Says We Argue Because We’re Listening Wrong. I Hear That.",It’s Probably One Of The Best Thing You Can Say To Someone Who Doesn’t Like You,2.0
53ac5919f33bfc43dd000006,53a7cd5e8fb8a0883900001a,"That One Time It Took Studying 25,000,000 Kids To Begin To Undo The Damage Caused By 1 Awful Doctor",A Scientist Doctors His Study To Make A Profit Off Of Sick Kids And Sets Global Health Back Decades,1.0
53ac5919f33bfc43dd000006,53a7cd5e8fb8a0883900001a,Remember That One Time A Scientist Made Up A Bunch Of Stuff So He Could Make Money Off Of Sick Kids?,"That One Time It Took Studying 25,000,000 Kids To Begin To Undo The Damage Caused By 1 Awful Doctor",2.0
53ac5aca227389bd0a000009,53ac2df767e86e475c00000c,You Know How A Sleeping Bag Feels Like A Warm Hug From A Close Friend? This Kind is Even Better.,Someone Just Invented The Best Kind Of Sleeping Bag I've Ever Seen,2.0
53ac5aca227389bd0a000009,53ac2df767e86e475c00000c,Her Idea Is A Warm Hug To The Idea Of Humanity,"Her Life-Saving Invention Looks Like A Body Bag, But It's Actually The Exact Opposite",2.0
53ac5aca227389bd0a000009,53ac2df767e86e475c00000c,Her Idea Is A Warm Hug To The Idea Of Humanity,Someone Just Invented The Best Kind Of Sleeping Bag I've Ever Seen,2.0
53ad737c29da14051a00004c,53ab359467e86e311700003b,"A Girl Takes A Walk, And The Whole World Feels Entitled To An Opinion","Some Days The Whole World Has An Opinion. But Really, Do They Have To Share It?",1.0
53adb24e52a102477100005f,53adc79152a102e539000043,The Reason These Guys Are Extra-Cautious Around Black People Isn't As Simple As You Might Think,"Racial Profiling Isn't So Shocking Anymore, But How It's Affecting The Way Victims See Each Other Is",1.0
53adb24e52a102477100005f,53adc79152a102e539000043,The Reason These Guys Are Extra-Cautious Around Black People Isn't As Simple As You Might Think,Knowing Their Rights Doesn’t Even Matter When They’re Targeted The Way They Are,1.0
53adb24e52a102477100005f,53adc79152a102e539000043,These Guys All Seem Like Smart And Caring Individuals. So Why Do Cops Assume The Worst Of Them?,The Reason These Guys Are Extra-Cautious Around Black People Isn't As Simple As You Might Think,2.0
53adb76029da14051a000084,53ac888f29da14190c000004,"If I Were Superwoman, I'd — Oh Right. I'm Not. And She's Not Either. But She IS A Person.","A Girl Takes A Walk, And The Whole World Feels Entitled To An Opinion",2.0
53adb76029da14051a000084,53ac888f29da14190c000004,"Oooh These Guys Make Me So Mad. I SO Want To Rewrite This Story. Hey, Maybe We Can!","A Girl Takes A Walk, And The Whole World Feels Entitled To An Opinion",2.0
53adb76029da14051a000084,53ac888f29da14190c000004,"If I Were Superwoman, I'd — Oh Right. I'm Not. And She's Not Either. But She IS A Person.",She Wants To Take A Walk Without The Whole World Telling Her What She Already Knows,2.0
53b1893846dab066c9000018,53b182e846dab08753000013,"Here’s A Map With Minimum Wage Rates Across The Country, State By State",Some States Can Let Companies Pay LESS THAN Minimum Wage?,1.0
53b1893846dab066c9000018,53b182e846dab08753000013,"Here’s A Map. If Your State Is Colored Green, Folks Are Doing Better Than If It's Colored Pink.",Some States Can Let Companies Pay LESS THAN Minimum Wage?,1.0
53b41f91cf4a0cf85d000013,53b41ebfcf4a0c8fb8000027,I Never Dreamed About Being A Homemaker Until I Saw How Suhhweeet These Women’s Jobs Are,"They Don’t Want Food Stamps, They Want An Opportunity. Here’s One That Came Right On Time.",1.0
53b47956d963e131f800009b,538c6b3526bfd710f200000a,"For Women Who’ve Had Mastectomies, The Monokini Is Nothing Short Of Revolutionary",Some Swimwear Plays Peekaboo. A Monokini Shows What These Women Don’t Want To Hide.,2.0
53b47956d963e131f800009b,538c6b3526bfd710f200000a,Unforgettable Pictures To Make You Think About Beauty And Nakedness. Not To Mention Survival.,"For Women Who’ve Had Mastectomies, The Monokini Is Nothing Short Of Revolutionary",1.0
53b8604655a05df1fd000010,53b860f20874020fbd000005,"People-As-Sex-Objects In Television Commercials Are A Common Occurrence, But Not Quite In This Way",Let's Apply The Female Stereotypes In These Commercials To Male Actors And See How That Looks,2.0
53b8604655a05df1fd000010,53b860f20874020fbd000005,Let's Apply The Female Stereotypes In These Commercials To Male Actors And See How That Looks,"If You Were Watching TV On Opposite Day, These Would Be The Sexed-Up Sirens Selling Junk On The Air",1.0
53b8604655a05df1fd000010,53b860f20874020fbd000005,Let's Apply The Female Stereotypes In These Commercials To Male Actors And See How That Looks,What If The Sex That Sold In Commercials Happened To Come Only From Men?,1.0
53b8604655a05df1fd000010,53b860f20874020fbd000005,Let's Apply The Female Stereotypes In These Commercials To Male Actors And See How That Looks,An Anti-Commercial Wants You To Ask Yourself Why So Many Ads Like It Still Get Made,1.0
53b8604655a05df1fd000010,53b860f20874020fbd000005,Let's Apply The Female Stereotypes In These Commercials To Male Actors And See How That Looks,"If A Man Seducing His Lady With Tortilla Chips Looks Silly, Why Doesn't It The Other Way Around?",1.0
53bb2fb61d9f3f370f000004,53b5ef0e9fdfe9ffd70000a2,One Chart: 50 Years Of Wealth Inequality In The United States,"As A 'Middle Class' American, I Found This Chart To Be A Little Offensive. Hopefully You Do Too.",2.0
53bb2fb61d9f3f370f000004,53b5ef0e9fdfe9ffd70000a2,One Chart: 50 Years Of Wealth Inequality In The United States,A Chart For Anyone Who Thinks Poor People Need To Pay More Taxes,2.0
53bb2fb61d9f3f370f000004,53b5ef0e9fdfe9ffd70000a2,Rich People Aren't Necessarily The Problem With Inequality. But All That Money Could Certainly Help.,"As A 'Middle Class' American, I Found This Chart To Be A Little Offensive. Hopefully You Do Too.",2.0
53be46e02c277d872a00006e,53c02d58e172b7f197000033,"In 2012, 26,000 Men And Women Reported Unwanted Sexual Advances. Only 302 Attackers Faced Charges.",The Hard Truth About Being A Female Soldier In Our Military Is Not Pretty,2.0
53be46e02c277d872a00006e,53c02d58e172b7f197000033,The Hard Truth About Being A Female Soldier In Our Military Is Not Pretty,"Our Soldiers Fight To Defend Our Country, Each And Every Day. If Only Their Bosses Would Too.",1.0
53be46e02c277d872a00006e,53c02d58e172b7f197000033,The Hard Truth About Being A Female Soldier In Our Military Is Not Pretty,Being A Soldier Is Hard Enough Without The Top Brass Not Protecting You From Sexual Assault,1.0
53be46e02c277d872a00006e,53c02d58e172b7f197000033,79% Of The Women Serving In The Military In The Last 40 Years Were Sexually Harassed Regularly,The Hard Truth About Being A Female Soldier In Our Military Is Not Pretty,2.0
53be46e02c277d872a00006e,53c02d58e172b7f197000033,The Hard Truth About Being A Female Soldier In Our Military Is Not Pretty,All The Soldiers Wanted Was Justice. Instead They Got The Military Justice System.,1.0
53beef0df8df06ec9700003d,53beec5526fbe594bd000036,"It's Rude, Scary And Awful. So Women Are Joining Together To Put An End To It—And Just Walk Home.",Find Out The Three Simple Words That Can Stop A Harasser Dead In His Tracks,2.0
53beef0df8df06ec9700003d,53beec5526fbe594bd000036,"It's Rude, Scary And Awful. So Women Are Joining Together To Put An End To It—And Just Walk Home.",A Woman With A Baby Was Being Harassed. Find Out The Three Unlikely Words That Saved Her.,2.0
53beef0df8df06ec9700003d,53beec5526fbe594bd000036,She Wasn't Looking For A Fight When She Spoke Up. She Just Wanted To Support Her Sister.,A Woman With A Baby Was Being Harassed. Find Out The Three Unlikely Words That Saved Her.,2.0
53beef0df8df06ec9700003d,53beec5526fbe594bd000036,Find Out The Three Simple Words That Can Stop A Harasser Dead In His Tracks,She Wasn't Looking For A Fight When She Spoke Up. She Just Wanted To Support Her Sister.,1.0
53bef3e2f8df064c3e00004a,53bef365f8df066c2300003f,Here’s A Quote From The Very First Republican President That Really Shocked Me,What Would Abraham Lincoln Think Of Labor Unions?,1.0
53bef3e2f8df064c3e00004a,53bef365f8df066c2300003f,What Would Abraham Lincoln Think Of Labor Unions?,"One Quote From Abraham Lincoln Might Just Surprise You, But It’s Real",2.0
53bf0d7df8df068d8a000064,53bee7f326fbe5cbf200002f,She’s Got A Problem With Common Core And She Ain’t Afraid To Calmly Explain Why It’s Awful,One Woman Explains How Kids Get Cheated By A Secret Committee And The For-Profit Testing Industry,1.0
53bf0d7df8df068d8a000064,53bee7f326fbe5cbf200002f,She’s Got A Problem With Common Core And She Ain’t Afraid To Calmly Explain Why It’s Awful,The Testing Industry Would Probably Prefer You Didn’t Hear Her Take On Our Education System,1.0
53bf0d7df8df068d8a000064,53bee7f326fbe5cbf200002f,Meet A Professor Who Has No Interest In Seeing Your Test Scores,She’s Got A Problem With Common Core And She Ain’t Afraid To Calmly Explain Why It’s Awful,2.0
53bf233b26fbe54fef000072,53bb85689a9bf15cb000002b,Want A Reason To Love Video Games? How About A Lovely Dose Of Acceptance.,An Actress Who Played A Gay Character In A Video Game Fights Tears As She Recounts A Fantastic Story,2.0
53bff270f8df0616600000ac,53bff292f8df068d8a0000ae,Why Does It Take A Million People To Show That There’s No Fight In L.O.V.E.?,Watch How Their Gay Rights Volunteers Make Other Volunteers Wish They Were These Volunteers,2.0
53c049984a4dbbc37f000033,53c04de35d80f0fce5000010,The President From ‘Scandal’ Wants People To Stop Avoiding A Historically Controversial Issue,'Scandal's' Tony Goldwyn Wants To Use Television To Get More People Talking About Stuff That Matters,1.0
53c1d63cc80404db5d00000e,53c1cd40c80404db5d000008,A Former Movie Star And Veteran Gave A Passionate Speech About A Topic No One Wants To Discuss,People Say No One Cares About Older People. Here's Your Chance To Prove That Wrong.,1.0
53c37521e274f9ca3c000030,53c376dd72263ee9a200002d,Watch A Funny Feminist Sing About Government Funny Business (Regarding Her Lady Business),A Bunch Of Clueless White Guys Are Probably Not The Right Guys To Tell This Girl What To Do,2.0
53c465d976a1349c95000052,5398b5cf326359acdf00008c,"Policemen Didn't Care, Politicians Did Nothing; So He Wrote A Song Catchy Enough To Make You Notice",A Song About This Big American Problem Is Better At The News Than The News Is,1.0
53c465d976a1349c95000052,5398b5cf326359acdf00008c,"Politicians Are Trying To Hide The Crime In His City, But He's Touring The World Singing About It","Policemen Didn't Care, Politicians Did Nothing; So He Wrote A Song Catchy Enough To Make You Notice",2.0
53c465d976a1349c95000052,5398b5cf326359acdf00008c,"Does A Bad Neighborhood Deserve To Be Wiped Off The Map, Stripped And Sold For Parts?","Policemen Didn't Care, Politicians Did Nothing; So He Wrote A Song Catchy Enough To Make You Notice",2.0
53c5d5d5845a35d0e2000047,53c43c5be274f995aa000064,"People Around Becca Didn’t Know What To Make Of Her, Which Is Pretty Much Everyone’s Fault But Hers","Don’t Worry, The Girl Yelling Into Her Hat Is Totally Cool. She’s Just Doing Her Thing.",1.0
53c5d5d5845a35d0e2000047,53c43c5be274f995aa000064,"Don’t Worry, The Girl Roaring Into Her Hat Is Totally Cool. She’s Just Doing Her Thing.","People Around Becca Didn’t Know What To Make Of Her, Which Is Pretty Much Everyone’s Fault But Hers",2.0
53c5d5d5845a35d0e2000047,53c43c5be274f995aa000064,"She’s Got A Sob Story, But What’s Really Important About Becca Is Her Death-Metal Violin","People Around Becca Didn’t Know What To Make Of Her, Which Is Pretty Much Everyone’s Fault But Hers",2.0
53c69e6529d067099600003d,53c3f350e274f9ca3c000056,Healthcare Getting Fixed Is About As Likely As This Grass Not Getting Thrown Up On,A Politician Gets Winded Just Talking About How Badly He's Going To Screw Up Healthcare,2.0
53c6c1fb29d067572b000040,53c5423def45ebae7f00003d,The US Congress Is More Diverse Than Ever...But It's Still Within Spitting Distance Of 1790,"If You Feel Like Congress Doesn't Care About People Like You, Here's A Chart That May Explain Why",2.0
53c6c1fb29d067572b000040,53c5423def45ebae7f00003d,"The Founders' Vision Of Government Of, By, And For Rich White Men Is Still Very Much Alive","If You Feel Like Congress Doesn't Care About People Like You, Here's A Chart That May Explain Why",2.0
53c6c1fb29d067572b000040,53c5423def45ebae7f00003d,81% Of Congress Has Major Common Ground With Obama. And With Every Other President.,"If You Feel Like Congress Doesn't Care About People Like You, Here's A Chart That May Explain Why",2.0
53c77f78d52a7babcf00000f,53c5e744a377818377000003,A Mom Shares Her Honest Story Of Motherhood And It's Quite Moving,Southern Baptist Mom Has Some Really Fabulous Comebacks To Some Really Terrible Questions,2.0
53c77f78d52a7babcf00000f,53c5e744a377818377000003,Proud Mom Gives A Brilliant 6 Minute Speech About Her Daughter. Nails It.,Southern Baptist Mom Has Some Really Fabulous Comebacks To Some Really Terrible Questions,2.0
53c77f78d52a7babcf00000f,53c5e744a377818377000003,Southern Baptist Mom Answers Bigot's Questions With Real Talk,Southern Baptist Mom Has Some Really Fabulous Comebacks To Some Really Terrible Questions,2.0
53c8124e4273de1af700005d,53c6ce9e29d067bcd9000047,How It Took About 30 People For 1 Swimmer To Make History,"You May Already Know About Her Epic Swim From Cuba To Florida, But Do You Know What Happened After?",2.0
53c8124e4273de1af700005d,53c6ce9e29d067bcd9000047,"She Got All The Fame For Her Amazing Journey, But She Wants You To Know She Didn't Do It Alone","You May Already Know About Her Epic Swim From Cuba To Florida, But Do You Know What Happened After?",2.0
53c96b38f35685f82b000068,53c96b06785a66342500007c,"He Had A Bad Experience With A Certain Group Of People When He Was Young, Which Explains A Lot",White People Wonder If He Knows He’s White. Black People Feel Have Mixed Feelings. He Calls It Art.,2.0
53c96b38f35685f82b000068,53c96b06785a66342500007c,How A Little Bookshop Is Changing The Way People Think About Race — One Walk-In At A Time,White People Wonder If He Knows He’s White. Black People Feel Have Mixed Feelings. He Calls It Art.,2.0
53cd16604f32a616af00000b,53cd1574ddae0f179c000008,"He Got So Many Moving Letters When He Came Out, But The One From The Iraqi Doctor Legit Floored Him",He Would Brag To His Fellow Soldiers About His Girlfriend All The Time. There Was Just One Problem.,2.0
53cd16604f32a616af00000b,53cd1574ddae0f179c000008,"The Army Needed His Skills, But He Needed His Honor More. So He Finally Told The Truth.",He Would Brag To His Fellow Soldiers About His Girlfriend All The Time. There Was Just One Problem.,2.0
